<?xml version="1.0" encoding="UTF-8" ?>
<Layers xmlns:xsi="http://www.w3.org/2001/XMLSchema-instance"
	xmlns="http://xml.util.cbsviewer.mineleni.nl" xsi:schemaLocation="http://xml.util.cbsviewer.mineleni.nl AvailableLayers.xsd">
	<!-- dit is een document met een volgens de xsd ongeldige test configuratie, 
		oa. voor AvailableLayersXMLTest -->
	<Layerdescriptor>
		<id>vierkanten500m_oad2000</id>
		<name>Vierkanten 500 x 500m - Omgevingsadressendichtheid 2000</name>
		<layers>omgevings_adres_dichtheid_2000</layers>
		<url>http://geodata.nationaalgeoregister.nl/cbsvierkanten500m/wms</url>
		<styles>cbsvierkanten500m.oad2000</styles>
		<attributes>oad2000</attributes>
	</Layerdescriptor>
	<Layerdescriptor>
		<!-- expres een al gebruikte id waarde -->
		<id>vierkanten500m_oad2000</id>
		<name>Vierkanten 500 x 500m - Omgevingsadressendichtheid 2000</name>
		<layers>omgevings_adres_dichtheid_2000</layers>
		<url>http://geodata.nationaalgeoregister.nl/cbsvierkanten500m/wms</url>
		<styles>cbsvierkanten500m.oad2000</styles>
		<attributes>oad2000</attributes>
	</Layerdescriptor>
</Layers>